record_id,collection_batch,source_platform,source_url,source_capture_method,firm_name,attorney_name,practice_area_primary,practice_area_secondary,city,state,review_rating,review_date,collection_date,reviewer_label,review_text_raw,review_text_normalized,owner_response_raw,provenance_note,source_firm_key,normalized_text_hash,length_bucket,weak_slice_tags,dataset_role,human_review_status,dedupe_status,dedupe_group_id,duplicate_of_record_id
nmilc_20260404_melina_1,20260328_wave80,google_maps,https://www.google.com/maps/place/New+Mexico+Immigration+Law+Center/data=!4m7!3m6!1s0x87220cc0d1b4f059:0x1d8f5329acf859e7!8m2!3d35.0833279!4d-106.6551468!16s%2Fg%2F11c58nsz24!19sChIJWfC00cAMIocR51n4rClTjx0?authuser=0&hl=en&rclk=1,agent_browser_capture_google_maps,New Mexico Immigration Law Center,,immigration,,Albuquerque,NM,1,5 years ago,2026-04-04,Melina,"Worst place ever! Please don’t waste your time here! Not professional at all, John Jabez or Jayden (I’m not sure) Anna and Stephanie Lawyer are very unprofessional employees! I wish I knew more about the people I spoke too. It’s such a waiting game, you always have to be the one calling them. I was told I would be able to speak with an attorney and got lied to when it came time for the appointment! Very disappointed! I was told I didn’t give them the “”right”” dates at the beginning of starting my DACA renewal application and that it was basically my fault they didn’t notice my DACA had been expired for about 3 years so obviously at this point I got rejected by Jayden and was told I wasn’t going to be helped! Pathetic to say that this place will “”try”” their best to help you! Not true please consider other organizations! Sorry to say that not a whole lot of places in New Mexico are helpful or professional! I’ve tried others as well.","worst place ever! please don't waste your time here! not professional at all, john jabez or jayden (i'm not sure) anna and stephanie lawyer are very unprofessional employees! i wish i knew more about the people i spoke too. it's such a waiting game, you always have to be the one calling them. i was told i would be able to speak with an attorney and got lied to when it came time for the appointment! very disappointed! i was told i didn't give them the """"right"""" dates at the beginning of starting my daca renewal application and that it was basically my fault they didn't notice my daca had been expired for about 3 years so obviously at this point i got rejected by jayden and was told i wasn't going to be helped! pathetic to say that this place will """"try"""" their best to help you! not true please consider other organizations! sorry to say that not a whole lot of places in new mexico are helpful or professional! i've tried others as well.",,Captured from public Google Maps place page via agent browser capture on 2026-04-04 after opening a visible one-star quote chip; full review text was visible in the live review panel.,new_mexico_immigration_law_center__nm,035ea281387d320872d7869a8e10ac708cdde781,long,low_star_contact_failure;low_star_expectation_break;long_form,corpus_only,,unique,,
utahcda_20260404_jeff_1,20260328_wave80,google_maps,"https://www.google.com/maps/place/Utah+Criminal+Defense+Attorneys/@40.698899,-111.9001526,17z/data=!3m1!4b1!4m6!3m5!1s0x87528b7a4c84b053:0xd54709103b7e367a!8m2!3d40.698899!4d-111.9001526!16s%2Fg%2F11h269gglq?authuser=0&hl=en&entry=ttu&g_ep=EgoyMDI2MDQwMS4wIKXMDSoASAFQAw%3D%3D",agent_browser_capture_google_maps,Utah Criminal Defense Attorneys,,criminal_defense,,Salt Lake City,UT,1,5 years ago,2026-04-04,Jeff,If your looking for the best go somewhere else. They never return calls. Twice the judge had to wait on them.,if your looking for the best go somewhere else. they never return calls. twice the judge had to wait on them.,,Captured from public Google Maps place page via agent browser capture on 2026-04-04 after opening the visible negative quote chip; full review text was visible in the live review panel.,utah_criminal_defense_attorneys__ut,2676f57674db73d78f1741ecc0b365da62edf9de,short,low_star_contact_failure;low_star_expectation_break,corpus_only,,unique,,
utahcda_20260404_brynnmudliar_5,20260328_wave80,google_maps,"https://www.google.com/maps/place/Utah+Criminal+Defense+Attorneys/@40.698899,-111.9001526,17z/data=!3m1!4b1!4m6!3m5!1s0x87528b7a4c84b053:0xd54709103b7e367a!8m2!3d40.698899!4d-111.9001526!16s%2Fg%2F11h269gglq?authuser=0&hl=en&entry=ttu&g_ep=EgoyMDI2MDQwMS4wIKXMDSoASAFQAw%3D%3D",agent_browser_capture_google_maps,Utah Criminal Defense Attorneys,Chris Ault,criminal_defense,,Salt Lake City,UT,5,2 years ago,2026-04-04,Brynn Mudliar,They are the best of the best. I highly recommend them and Chris Ault really fights for you. You are not just a number. He returns calls quickly and is fighting for you/me. I would never go anywhere else.,they are the best of the best. i highly recommend them and chris ault really fights for you. you are not just a number. he returns calls quickly and is fighting for you/me. i would never go anywhere else.,,Captured from public Google Maps place page via agent browser capture on 2026-04-04; full review text was visible in the live page snapshot.,utah_criminal_defense_attorneys__ut,c182ebb9b09ee527eb09b37dafc3b097599cb388,medium,explicit_positive_trust,corpus_only,,unique,,
joshlee_20260404_davidd_5,20260328_wave80,google_maps,https://www.google.com/maps/place/Josh+Lee+%26+Associates+Criminal+Defense+%26+DUI+Attorneys/data=!4m7!3m6!1s0x87b21aee9f2b4015:0xef52e73a00d75af9!8m2!3d35.3853593!4d-97.5475891!16s%2Fg%2F1tcxdq99!19sChIJFUArn-4asocR-VrXADrnUu8?authuser=0&hl=en&rclk=1,agent_browser_capture_google_maps,Josh Lee & Associates Criminal Defense & DUI Attorneys,Josh Lee,criminal_defense,,Oklahoma City,OK,5,5 months ago,2026-04-04,David D,"Josh Lee was my lawyer for my criminal case, and I couldn’t have asked for better representation. He’s very knowledgeable and did an excellent job explaining everything to me step by step, making sure I fully understood what was happening throughout the whole process. He was professional, patient. The secretary was also very kind and helpful every time I called or came into the office. Overall, it’s a great law office very organized, respectful, and truly focused on helping their clients. I highly recommend Josh Lee for anyone looking for a reliable and experienced criminal defense lawyer.","josh lee was my lawyer for my criminal case, and i couldn't have asked for better representation. he's very knowledgeable and did an excellent job explaining everything to me step by step, making sure i fully understood what was happening throughout the whole process. he was professional, patient. the secretary was also very kind and helpful every time i called or came into the office. overall, it's a great law office very organized, respectful, and truly focused on helping their clients. i highly recommend josh lee for anyone looking for a reliable and experienced criminal defense lawyer.",,Captured from public Google Maps place page via agent browser capture on 2026-04-04; full review text was visible in the live page snapshot.,josh_lee_associates_criminal_defense_dui_attorneys__ok,b93b7061809da9a34d5499db79b27e85a62778d3,medium,explicit_positive_trust;explicit_positive_outcome;long_form,corpus_only,,unique,,
gavlin_20260404_anonymous_2,20260328_wave80,avvo,https://www.avvo.com/attorneys/10007-ny-nataliya-gavlin-1791518.html?rating=2,agent_web_capture_avvo,Nataliya I. Gavlin,Nataliya I. Gavlin,immigration,,New York,NY,2,"November 08, 2018",2026-04-04,anonymous,"Once she was compensated, she dropped into radio silence. She also has little to no support staff, so is almost always inaccessible. Often traveling or on vacation, so adds to difficulty of making contact.","once she was compensated, she dropped into radio silence. she also has little to no support staff, so is almost always inaccessible. often traveling or on vacation, so adds to difficulty of making contact.",,Captured from public Avvo attorney review page on 2026-04-04 after filtering to 2-star reviews; full review text was visible in page output.,nataliya_i_gavlin__ny,3aa3c037fb1886fb0ed72134aab72f3702e443ce,short,low_star_contact_failure;low_star_expectation_break,corpus_only,,unique,,
matthewnielson_20260404_anonymous_2,20260328_wave80,lawyers_com,https://www.lawyers.com/sandy/utah/matthew-nielson-disability-law-161097405-f/,agent_web_capture_lawyers_com,Matthew Nielson Disability Law,Matthew Nielson,social_security_disability,,Sandy,UT,2,"January 25, 2026",2026-04-04,anonymous,"He really did nothing but take you're money. I should have done it by myself. He doesn't speed up process and you do all the work. He takes 9,000 for doing nothing.I wouldn't recommend him but most lawyers are like this.","he really did nothing but take you're money. i should have done it by myself. he doesn't speed up process and you do all the work. he takes 9,000 for doing nothing.i wouldn't recommend him but most lawyers are like this.",,Captured from public Lawyers.com attorney review page on 2026-04-04 with a visible full-text 2-star Social Security Disability review in the page HTML output.,matthew_nielson_disability_law__ut,38108d499c2a7e6e37795ccdaa6b52b66640db16,medium,low_star_expectation_break;trust_vs_outcome_ambiguity,corpus_only,,unique,,
collins_20260404_anonymous_2,20260328_wave80,lawyers_com,https://www.lawyers.com/columbia/maryland/the-collins-firm-3255783-f/?reviewsPage=4#reviews,agent_web_capture_lawyers_com,The Collins Firm,,estate_planning,probate,Columbia,MD,2,"July 12, 2015",2026-04-04,anonymous,"Very responsive, but did not follow through. They seem to have cookie cutter trust documents that overcomplicate things when put into play. That has been the case with my fathers trust. Furthermore, they told us that any minor changes would be done without charge and then told us they had no such policy when we needed a small adjustment. Poor quality and ethic.","very responsive, but did not follow through. they seem to have cookie cutter trust documents that overcomplicate things when put into play. that has been the case with my fathers trust. furthermore, they told us that any minor changes would be done without charge and then told us they had no such policy when we needed a small adjustment. poor quality and ethic.",,Captured from public Lawyers.com firm review page on 2026-04-04 with a visible full-text 2-star Trusts and Estates review in the page HTML output.,the_collins_firm__md,d89588e1e48e91cb01410bec994929a74272f36e,medium,low_star_expectation_break;low_star_clarity_break;long_form,corpus_only,,unique,,
stamm_20260404_anonymous_2,20260328_wave80,lawyers_com,https://www.lawyers.com/greenbelt/maryland/leonard-r-stamm-634044-a/,agent_web_capture_lawyers_com,Leonard R. Stamm,Leonard R. Stamm,criminal_defense,dui_dwi,Greenbelt,MD,2,"March 09, 2014",2026-04-04,anonymous,I ended up being convicted on 15 out 18 charges in District Court while being represented by Leonard Stamm. He tried my case in front of Judge Cornelius Vaughey where I received close to the maximum sentenced certainly above the average in Montgomery County MD for 2nd offense DUIs. This was in addition to the 30 days spent in an inpatient program that Mr. Stamm strongly recommended. Mr. Stamm is knowledgeable about DUI law but did not care about the outcome of the case and made no effort.,i ended up being convicted on 15 out 18 charges in district court while being represented by leonard stamm. he tried my case in front of judge cornelius vaughey where i received close to the maximum sentenced certainly above the average in montgomery county md for 2nd offense duis. this was in addition to the 30 days spent in an inpatient program that mr. stamm strongly recommended. mr. stamm is knowledgeable about dui law but did not care about the outcome of the case and made no effort.,,Captured from public Lawyers.com attorney review page on 2026-04-04 with a visible full-text 2-star Criminal Law review in the page HTML output.,leonard_r_stamm__md,3b644b327f481cf6b92b4340099868897c7308bf,medium,low_star_expectation_break;trust_vs_outcome_ambiguity;long_form,corpus_only,,unique,,
downard_20260404_anonymous_2,20260328_wave80,lawyers_com,https://www.lawyers.com/chattanooga/tennessee/downard-and-associates-157890819-f/?reviewsPage=3,agent_web_capture_lawyers_com,Downard & Associates,,social_security_disability,,Chattanooga,TN,2,"March 09, 2012",2026-04-04,anonymous,"Not any really. After about 3 years I finally received my disability. I did most of the leg work, and was only disappointed because he received so much of my pay out. Money that I needed to live.","not any really. after about 3 years i finally received my disability. i did most of the leg work, and was only disappointed because he received so much of my pay out. money that i needed to live.",,Captured from public Lawyers.com firm review page on 2026-04-04 with a visible full-text 2-star Social Security review in the page HTML output after the Pass 37 Google Maps surfacing threshold was re-earned.,downard_associates__tn,86fdcd72c9efe73869459a9cc4d7b709546763c4,medium,low_star_expectation_break;trust_vs_outcome_ambiguity,corpus_only,,unique,,
ashmore_20260404_anonymous_2,20260328_wave80,lawyers_com,https://www.lawyers.com/greenville/south-carolina/ashmore-leaphart-rabon-llc-1588275-f/,agent_web_capture_lawyers_com,"Ashmore Leaphart & Rabon, LLC",,estate_planning,probate,Greenville,SC,2,"November 28, 2012",2026-04-04,anonymous,The lawyer seemed to give up after a few months. My settlement was not to my satisfaction.,the lawyer seemed to give up after a few months. my settlement was not to my satisfaction.,,Captured from public Lawyers.com firm review page on 2026-04-04 with a visible full-text 2-star Trusts and Estates review in the page HTML output after the Pass 37 Google Maps surfacing threshold was re-earned.,ashmore_leaphart_rabon_llc__sc,d47d0ded575f0253a6f2cd693107b0713adf8a49,short,low_star_expectation_break,corpus_only,,unique,,
alanross_20260404_anonymous_2,20260328_wave80,lawyers_com,https://www.lawyers.com/harrisburg/pennsylvania/law-office-of-alan-michael-ross-43121644-f/,agent_web_capture_lawyers_com,Law Office of Alan Michael Ross,Alan Michael Ross,criminal_defense,,Harrisburg,PA,2,"June 07, 2011",2026-04-04,anonymous,He was a bully towards me. He forgot the number one rule I thought which was I am innocent till proven guilty. He forgot about my right to privacy. He also did not seem to be experienced in my case when it came to trial.,he was a bully towards me. he forgot the number one rule i thought which was i am innocent till proven guilty. he forgot about my right to privacy. he also did not seem to be experienced in my case when it came to trial.,,Captured from public Lawyers.com firm review page on 2026-04-04 with a visible full-text 2-star Criminal Law review in the page HTML output after the Pass 37 Google Maps surfacing threshold was re-earned.,law_office_of_alan_michael_ross__pa,b021a1c4a8409b0b7c8883fbd18b220145c17081,medium,low_star_expectation_break;trust_vs_outcome_ambiguity,corpus_only,,unique,,
fulton_20260404_mihalisspiliotopoulos_5,20260328_wave80,google_maps,"https://www.google.com/maps/place/Philip+J.+Fulton+Law+Office/@39.9688393,-85.3066395,8z/data=!3m1!5s0x88388f2ebc4519a9:0x770d18e5cffa9076!4m12!1m2!2m1!1ssocial+security+disability+attorney+Columbus+OH!3m8!1s0x88388f2ebdb75551:0xa0e57b9b139da84f!8m2!3d39.9688393!4d-82.9995106!9m1!1b1!15sCi9zb2NpYWwgc2VjdXJpdHkgZGlzYWJpbGl0eSBhdHRvcm5leSBDb2x1bWJ1cyBPSCIDiAEBWjEiL3NvY2lhbCBzZWN1cml0eSBkaXNhYmlsaXR5IGF0dG9ybmV5IGNvbHVtYnVzIG9okgEWcGVyc29uYWxfaW5qdXJ5X2xhd3llcpoBJENoZERTVWhOTUc5blMwVkpRMEZuU1VSa2NqUXRZVE4zUlJBQuABAPoBBAgAEDM!16s%2Fg%2F1tddsw02?entry=ttu&g_ep=EgoyMDI2MDQwMS4wIKXMDSoASAFQAw%3D%3D",agent_browser_capture_google_maps,Philip J. Fulton Law Office,,social_security_disability,workers_compensation,Columbus,OH,5,4 weeks ago,2026-04-04,Mihalis Spiliotopoulos,"I have been a client of Mr.Fulton since 2021, after being denied by multiple different lawyers since 2014. And I'm glad they did, Mr.Fulton and his team are the best and helped me with my case more than I could have imagined. I want to say thank you! And if anyone is looking for someone to represent them Fulton law firm should be your first call.","i have been a client of mr.fulton since 2021, after being denied by multiple different lawyers since 2014. and i'm glad they did, mr.fulton and his team are the best and helped me with my case more than i could have imagined. i want to say thank you! and if anyone is looking for someone to represent them fulton law firm should be your first call.",,Captured from public Google Maps place page via agent browser capture on 2026-04-04; full review text visible in live page snapshot.,philip_j_fulton_law_office__oh,b726df83c4c96fcee07c2660d41d3e7ffe10943e,medium,explicit_positive_outcome;explicit_positive_trust;long_form,corpus_only,,unique,,
fulton_20260404_ronnietaylor_5,20260328_wave80,google_maps,"https://www.google.com/maps/place/Philip+J.+Fulton+Law+Office/@39.9688393,-85.3066395,8z/data=!3m1!5s0x88388f2ebc4519a9:0x770d18e5cffa9076!4m12!1m2!2m1!1ssocial+security+disability+attorney+Columbus+OH!3m8!1s0x88388f2ebdb75551:0xa0e57b9b139da84f!8m2!3d39.9688393!4d-82.9995106!9m1!1b1!15sCi9zb2NpYWwgc2VjdXJpdHkgZGlzYWJpbGl0eSBhdHRvcm5leSBDb2x1bWJ1cyBPSCIDiAEBWjEiL3NvY2lhbCBzZWN1cml0eSBkaXNhYmlsaXR5IGF0dG9ybmV5IGNvbHVtYnVzIG9okgEWcGVyc29uYWxfaW5qdXJ5X2xhd3llcpoBJENoZERTVWhOTUc5blMwVkpRMEZuU1VSa2NqUXRZVE4zUlJBQuABAPoBBAgAEDM!16s%2Fg%2F1tddsw02?entry=ttu&g_ep=EgoyMDI2MDQwMS4wIKXMDSoASAFQAw%3D%3D",agent_browser_capture_google_maps,Philip J. Fulton Law Office,,social_security_disability,workers_compensation,Columbus,OH,5,2 months ago,2026-04-04,Ronnie Taylor,After another law firm put my case of TBI and post concussion syndrome and a jacked up neck on the back burner letting my life fall in shambles with no light at the end of tunnel Micheal figured things out had the ball rolling inside a couple weeks we had the dho hearing at the ic  on Friday now just waiting on workers comp to do what they may. Say a prayer on that for me but this law office is in it for the win,after another law firm put my case of tbi and post concussion syndrome and a jacked up neck on the back burner letting my life fall in shambles with no light at the end of tunnel micheal figured things out had the ball rolling inside a couple weeks we had the dho hearing at the ic on friday now just waiting on workers comp to do what they may. say a prayer on that for me but this law office is in it for the win,,Captured from public Google Maps place page via agent browser capture on 2026-04-04; full review text visible in live page snapshot.,philip_j_fulton_law_office__oh,fada2b80fbf4f1b207175f0949687e0275311d0a,medium,explicit_positive_outcome;explicit_positive_trust;long_form,corpus_only,,unique,,
anchor_20260404_nanhmel_5,20260328_wave80,google_maps,"https://www.google.com/maps/place/Anchor+Legal+Group,+PLLC/@36.844447,-76.3223246,12z/data=!3m1!5s0x89ba95e1e12828cd:0xae4c806bf0b4d547!4m10!1m2!2m1!1sestate+planning+attorney+Virginia+Beach+VA!3m6!1s0x89ba95ec8da98f2b:0x7a77f56f51b8111d!8m2!3d36.844447!4d-76.178129!15sCiplc3RhdGUgcGxhbm5pbmcgYXR0b3JuZXkgVmlyZ2luaWEgQmVhY2ggVkFaLCIqZXN0YXRlIHBsYW5uaW5nIGF0dG9ybmV5IHZpcmdpbmlhIGJlYWNoIHZhkgEWcGVyc29uYWxfaW5qdXJ5X2xhd3llcpoBI0NoWkRTVWhOTUc5blMwVkpRMEZuVFVSM2JIQlFhVkYzRUFF4AEA-gEFCNUBEEg!16s%2Fg%2F11n08fc0lb?entry=ttu&g_ep=EgoyMDI2MDQwMS4wIKXMDSoASAFQAw%3D%3D",agent_browser_capture_google_maps,"Anchor Legal Group, PLLC",,estate_planning,probate,Virginia Beach,VA,5,2 months ago,2026-04-04,Nanh Mel,"I just wanted to thank Mr Lentz and the whole team. There's not enough stars on the rating scale for the service I received, in the timeline they were given. Two of my dear friend and I received completely different services, from 3 different people,  but we agreed to have received exceptional treatments. Mr. Lentz was patient in ""teaching"" the process while answering my questions. From the sweet lady at the front fest to the whole team in the back, thank you! I 100% recommend this firm!","i just wanted to thank mr lentz and the whole team. there's not enough stars on the rating scale for the service i received, in the timeline they were given. two of my dear friend and i received completely different services, from 3 different people, but we agreed to have received exceptional treatments. mr. lentz was patient in ""teaching"" the process while answering my questions. from the sweet lady at the front fest to the whole team in the back, thank you! i 100% recommend this firm!","Thank you so much for your thoughtful review. Our team truly appreciates your trust, and we're happy we could be there for you. Wishing you all the best moving forward.",Captured from public Google Maps place page via agent browser capture on 2026-04-04; full review text visible in live page snapshot.,anchor_legal_group_pllc__va,97e3abc6714593ed60412eb01375d94a483236c3,medium,explicit_positive_trust;long_form,corpus_only,,unique,,
newfrontier_20260404_michaeljones_1,20260328_wave80,google_maps,"https://www.google.com/maps/place/New+Frontier+Immigration+Law/@33.4599444,-112.0823207,17z/data=!4m8!3m7!1s0x872b13e7a7465d3d:0x23f216f055126c22!8m2!3d33.4599444!4d-112.0823207!9m1!1b1!16s%2Fg%2F11gnpzc7mf?authuser=0&hl=en&entry=ttu&g_ep=EgoyMDI2MDQwMS4wIKXMDSoASAFQAw%3D%3D",agent_browser_capture_google_maps,New Frontier Immigration Law,,immigration,,Phoenix,AZ,1,a month ago,2026-04-04,Michael Jones,"Charges 2000 dollars for daca renewal fee
605 govt fee since they are filing paper when it can be done for 555 online.
Then charges 99 fee for filing for you.

I understand the government fee since it's what the government collects. But I called around and most other attorneys are between 550-1200 to do paperwork for you.

Go somewhere else.
I chose to file with Vianey Hurtado. Way cheaper and actual real people on the phone",charges 2000 dollars for daca renewal fee 605 govt fee since they are filing paper when it can be done for 555 online. then charges 99 fee for filing for you. i understand the government fee since it's what the government collects. but i called around and most other attorneys are between 550-1200 to do paperwork for you. go somewhere else. i chose to file with vianey hurtado. way cheaper and actual real people on the phone,"Hola Michael , 

Thank you for sharing your feedback. We understand that individuals may compare different options when seeking immigration services.

At New Frontier Immigration Law, we strive to provide clear information about our services, processes, and associated fees so clients can make informed decisions. Costs may vary depending on the level of legal support and services provided.

We respect your decision and wish you the best with your DACA renewal process.",Captured from public Google Maps place page via agent browser capture on 2026-04-04; full review text visible in live page snapshot.,new_frontier_immigration_law__az,1a416589e6743d6d4c415aba9db8de650f6d0727,medium,low_star_expectation_break;low_star_clarity_break;long_form,corpus_only,,unique,,
newfrontier_20260404_alexia_1,20260328_wave80,google_maps,"https://www.google.com/maps/place/New+Frontier+Immigration+Law/@33.4599444,-112.0823207,17z/data=!4m8!3m7!1s0x872b13e7a7465d3d:0x23f216f055126c22!8m2!3d33.4599444!4d-112.0823207!9m1!1b1!16s%2Fg%2F11gnpzc7mf?authuser=0&hl=en&entry=ttu&g_ep=EgoyMDI2MDQwMS4wIKXMDSoASAFQAw%3D%3D",agent_browser_capture_google_maps,New Frontier Immigration Law,,immigration,,Phoenix,AZ,1,4 months ago,2026-04-04,Alexia,"We have had a case here for three years and while we had a great experience at the beginning dealing with the back and forth communication, it all changed. We have now been dealing with the law team back and forth since this summer trying to find a solution for our case because the waiver we paid to be filed is not something we qualify for. This is something that the team knew at least six months in but somehow did not make it known to us until this year. Had I known that we didn't qualify for this waiver, I wouldn't have given you guys a cent. I feel we were misled and the poor communication we have been dealing with is unacceptable. We are at our wit's end and need a solution ASAP. During such difficult times, it's not something we should have to deal with.","we have had a case here for three years and while we had a great experience at the beginning dealing with the back and forth communication, it all changed. we have now been dealing with the law team back and forth since this summer trying to find a solution for our case because the waiver we paid to be filed is not something we qualify for. this is something that the team knew at least six months in but somehow did not make it known to us until this year. had i known that we didn't qualify for this waiver, i wouldn't have given you guys a cent. i feel we were misled and the poor communication we have been dealing with is unacceptable. we are at our wit's end and need a solution asap. during such difficult times, it's not something we should have to deal with.","Hello Alexia,
Thank you for speaking with me today and for your feedback. We're glad to confirm that the issue has been resolved and your refund has been processed. Our team will continue coordinating the next steps regarding your interest in a full FOIA service. We appreciate the opportunity to serve you.",Captured from public Google Maps place page via agent browser capture on 2026-04-04; full review text visible in live page snapshot.,new_frontier_immigration_law__az,4761551225ba297c3500c40280e84ed4cfe0acee,long,low_star_contact_failure;low_star_expectation_break;low_star_clarity_break;long_form,corpus_only,,unique,,
