record_id,collection_batch,firm_name,review_rating,source_platform,state,practice_area_primary,weak_slice_tags,dataset_role,benchmark_candidate_flag,holdout_flag,audit_only_flag,sentiment_mix_tag,candidate_reason,human_review_status,label_status,labeler,label_reviewed_at,expected_labels_json,truth_decision_note
dell_20260328_tarita_5,20260328_phase1,Disability Insurance Attorneys Dell & Schaefer,5,trustpilot,FL,disability_ssi,explicit_positive_outcome;explicit_positive_trust;long_form,holdout,false,true,false,positive_single_tone,Long-form explicit positive outcome and trust row from disability practice; good later contrast case.,triaged,reserved_holdout,,,,
dell_20260328_vivavaleur_2,20260328_phase1,Disability Insurance Attorneys Dell & Schaefer,2,trustpilot,FL,disability_ssi,low_star_expectation_break;trust_vs_outcome_ambiguity;long_form,audit_only,false,false,true,negative_single_tone,"Heavy expectation versus outcome framing with benchmark-design ambiguity around settlement, tax, and lien complaints.",triaged,audit_only,,,,
dell_20260328_riantroyer_1,20260328_phase1,Disability Insurance Attorneys Dell & Schaefer,1,trustpilot,FL,disability_ssi,low_star_expectation_break;low_star_contact_failure;long_form,benchmark_candidate,true,false,false,negative_single_tone,"Kept. Strong one-star disability review with clear expectation collapse and trust failure, even though the contact signal is weaker than the initial weak-slice tag suggested.",reviewed_candidate_subset,reviewed_candidate,parent_agent,2026-03-28,"[{""theme"": ""expectation_setting"", ""polarity"": ""negative"", ""severity"": ""severe_negative"", ""evidence"": ""Dell never started the LTD claim""}, {""theme"": ""professionalism_trust"", ""polarity"": ""negative"", ""severity"": ""severe_negative"", ""evidence"": ""The contract doesn't say a single thing Dell will do for you""}]","Kept. Strong one-star disability review with clear expectation collapse and trust failure, even though the contact signal is weaker than the initial weak-slice tag suggested."
dell_20260328_ruby_5,20260328_phase1,Disability Insurance Attorneys Dell & Schaefer,5,trustpilot,FL,disability_ssi,explicit_positive_outcome;explicit_positive_trust;long_form,benchmark_candidate,true,false,false,positive_single_tone,Kept. Explicit successful outcome plus unusually direct trust language.,reviewed_candidate_subset,reviewed_candidate,parent_agent,2026-03-28,"[{""theme"": ""outcome_satisfaction"", ""polarity"": ""positive"", ""severity"": ""positive"", ""evidence"": ""successfully appealed my LTD insurance claim denial, and I was approved within weeks""}, {""theme"": ""professionalism_trust"", ""polarity"": ""positive"", ""severity"": ""positive"", ""evidence"": ""genuine care and trust seems so elusive""}]",Kept. Explicit successful outcome plus unusually direct trust language.
mckennon_20260328_mike_5,20260328_phase1,McKennon Law Group PC,5,trustpilot,CA,disability_ssi,explicit_positive_outcome;explicit_positive_trust;long_form,benchmark_candidate,true,false,false,positive_single_tone,"Kept. Clean positive disability row with explicit trust, clarity, and outcome signals.",reviewed_candidate_subset,reviewed_candidate,parent_agent,2026-03-28,"[{""theme"": ""professionalism_trust"", ""polarity"": ""positive"", ""severity"": ""positive"", ""evidence"": ""professional, patient, and incredibly knowledgeable""}, {""theme"": ""communication_clarity"", ""polarity"": ""positive"", ""severity"": ""positive"", ""evidence"": ""explaining every step""}, {""theme"": ""outcome_satisfaction"", ""polarity"": ""positive"", ""severity"": ""positive"", ""evidence"": ""the outcome I deserved""}]","Kept. Clean positive disability row with explicit trust, clarity, and outcome signals."
mckennon_20260328_mikehammers_4,20260328_phase1,McKennon Law Group PC,4,trustpilot,CA,disability_ssi,mixed_4_star;explicit_positive_outcome,holdout,false,true,false,mixed,Useful mixed 4-star disability row with explicit positive outcome wording for later blind evaluation.,triaged,reserved_holdout,,,,
mckennon_20260328_christicampo_5,20260328_phase1,McKennon Law Group PC,5,trustpilot,CA,disability_ssi,explicit_positive_outcome;explicit_positive_trust;long_form,corpus_only,false,false,false,positive_single_tone,"Strong positive row, but similar to other explicit positive disability rows already promoted ahead of it.",triaged,corpus_only,,,,
serva_20260328_camthuy_5,20260328_phase1,Serva Law Group,5,trustpilot,FL,estate_planning,explicit_positive_trust;explicit_positive_outcome;long_form,corpus_only,false,false,false,positive_single_tone,"Good estate-planning positive row, but less urgent than weak-slice and mixed-sentiment rows.",triaged,corpus_only,,,,
serva_20260328_dunguyen_5,20260328_phase1,Serva Law Group,5,trustpilot,FL,estate_planning,explicit_positive_trust;long_form,corpus_only,false,false,false,positive_single_tone,"Useful corpus expansion for positive trust language, but still generic enough to hold out of first benchmark prep.",triaged,corpus_only,,,,
ashoori_20260328_nayanamana_5,20260328_phase1,Ashoori Law,5,trustpilot,CA,immigration,explicit_positive_trust;explicit_positive_outcome;long_form,benchmark_candidate,true,false,false,positive_single_tone,"Kept. Strong positive immigration row with explicit clarity, responsiveness, expectation, and outcome language.",reviewed_candidate_subset,reviewed_candidate,parent_agent,2026-03-28,"[{""theme"": ""communication_clarity"", ""polarity"": ""positive"", ""severity"": ""positive"", ""evidence"": ""clear about the requirements, timelines, and documentation""}, {""theme"": ""communication_responsiveness"", ""polarity"": ""positive"", ""severity"": ""positive"", ""evidence"": ""responsive whenever I had questions""}, {""theme"": ""expectation_setting"", ""polarity"": ""positive"", ""severity"": ""positive"", ""evidence"": ""realistic and transparent about the process""}, {""theme"": ""outcome_satisfaction"", ""polarity"": ""positive"", ""severity"": ""positive"", ""evidence"": ""handled properly and without issues""}]","Kept. Strong positive immigration row with explicit clarity, responsiveness, expectation, and outcome language."
century_20260328_paulhowell_5,20260328_phase1,Century Law Firm,5,trustpilot,FL,debt_defense,explicit_positive_trust,corpus_only,false,false,false,positive_single_tone,Short positive trust row with lighter benchmark value than the stronger long-form positives.,triaged,corpus_only,,,,
sterling_20260328_jessicabcookie_1,20260328_phase1,"Sterling Lawyers, LLC",1,google_maps,WI,family_law,low_star_contact_failure;low_star_expectation_break,corpus_only,false,false,false,negative_single_tone,"Downgraded. Clear complaint, but too short and thin to carry benchmark-driving pressure on its own.",reviewed_candidate_subset,downgraded_to_corpus_only,parent_agent,2026-03-28,[],"Downgraded. Clear complaint, but too short and thin to carry benchmark-driving pressure on its own."
sterling_20260328_nickzimpel_1,20260328_phase1,"Sterling Lawyers, LLC",1,google_maps,WI,family_law,low_star_contact_failure;low_star_expectation_break;trust_vs_outcome_ambiguity;long_form,audit_only,false,false,true,negative_single_tone,"Overloaded low-star narrative mixing paperwork, outcome, billing, and responsiveness in a way that could create noisy truth pressure.",triaged,audit_only,,,,
sterling_20260328_kylierinderman_1,20260328_phase1,"Sterling Lawyers, LLC",1,google_maps,WI,family_law,low_star_contact_failure;low_star_expectation_break;long_form,benchmark_candidate,true,false,false,negative_single_tone,Kept. Strong one-star family-law row with explicit nonresponse and serious representation failure.,reviewed_candidate_subset,reviewed_candidate,parent_agent,2026-03-28,"[{""theme"": ""communication_responsiveness"", ""polarity"": ""negative"", ""severity"": ""severe_negative"", ""evidence"": ""NEVER returned emails""}, {""theme"": ""professionalism_trust"", ""polarity"": ""negative"", ""severity"": ""severe_negative"", ""evidence"": ""didn?t even show up for my hearing""}, {""theme"": ""professionalism_trust"", ""polarity"": ""negative"", ""severity"": ""negative"", ""evidence"": ""She was very disrespectful""}]",Kept. Strong one-star family-law row with explicit nonresponse and serious representation failure.
scottsdalefamilylaw_20260328_jasonthibodeau_1,20260328_phase1,Scottsdale Family Law,1,google_maps,AZ,family_law,low_star_expectation_break;trust_vs_outcome_ambiguity;long_form,audit_only,false,false,true,negative_single_tone,Emotionally charged low-star narrative with hyperbolic language and multiple overlapping trust versus outcome complaints.,triaged,audit_only,,,,
scottsdalefamilylaw_20260328_janninehedger_2,20260328_phase1,Scottsdale Family Law,2,google_maps,AZ,family_law,low_star_expectation_break;trust_vs_outcome_ambiguity,holdout,false,true,false,negative_single_tone,Clean two-star disappointment and follow-through row worth saving for later blind evaluation.,triaged,reserved_holdout,,,,
yourfamilylawcenter_20260328_meganwigtion_1,20260328_phase1,"Your Family Law Center, S.C.",1,google_maps,WI,family_law,low_star_contact_failure;low_star_expectation_break;trust_vs_outcome_ambiguity;long_form,audit_only,false,false,true,negative_single_tone,"Very rich but overloaded row with communication failure, conflict issue, billing, and privacy-breach facts that need careful human truth handling.",triaged,audit_only,,,,
yourfamilylawcenter_20260328_trevornetti_1,20260328_phase1,"Your Family Law Center, S.C.",1,google_maps,WI,family_law,low_star_contact_failure;low_star_expectation_break;long_form,benchmark_candidate,true,false,false,negative_single_tone,Kept. Still sharp enough for later truth review because the communication failure is explicit and central.,reviewed_candidate_subset,reviewed_candidate,parent_agent,2026-03-28,"[{""theme"": ""communication_responsiveness"", ""polarity"": ""negative"", ""severity"": ""severe_negative"", ""evidence"": ""not inform me about a warrant""}, {""theme"": ""professionalism_trust"", ""polarity"": ""negative"", ""severity"": ""severe_negative"", ""evidence"": ""they will take your money and screw you""}, {""theme"": ""expectation_setting"", ""polarity"": ""negative"", ""severity"": ""negative"", ""evidence"": ""not following through""}]",Kept. Still sharp enough for later truth review because the communication failure is explicit and central.
cordell_20260328_kimberlyweddle_2,20260328_phase1,Cordell & Cordell | Family Law & Divorce,2,google_maps,WI,family_law,low_star_expectation_break;trust_vs_outcome_ambiguity;long_form,benchmark_candidate,true,false,false,negative_single_tone,Kept. Strong two-star representation-failure row with concrete filing and court-impact facts.,reviewed_candidate_subset,reviewed_candidate,parent_agent,2026-03-28,"[{""theme"": ""expectation_setting"", ""polarity"": ""negative"", ""severity"": ""severe_negative"", ""evidence"": ""did not file the paperwork that needed to be submitted""}, {""theme"": ""outcome_satisfaction"", ""polarity"": ""negative"", ""severity"": ""negative"", ""evidence"": ""the mistakes made in court will cost us greatly""}]",Kept. Strong two-star representation-failure row with concrete filing and court-impact facts.
cordell_20260328_josepharsenault_2,20260328_phase1,Cordell & Cordell | Family Law & Divorce,2,google_maps,WI,family_law,low_star_expectation_break;trust_vs_outcome_ambiguity;long_form,holdout,false,true,false,negative_single_tone,Strong two-star family-law row with expectation and trust-versus-outcome tension suitable for later holdout testing.,triaged,reserved_holdout,,,,
cordell_20260328_bobbialbro_2,20260328_phase1,Cordell & Cordell | Family Law & Divorce,2,google_maps,WI,family_law,low_star_expectation_break;trust_vs_outcome_ambiguity;long_form,corpus_only,false,false,false,negative_single_tone,"Useful low-star fee-value complaint, but too generic for first benchmark-prep pressure.",triaged,corpus_only,,,,
matiasrueda_20260328_pedro_4,20260328_phase1,Matias Jose Rueda,4,avvo,TX,family_law,mixed_4_star,corpus_only,false,false,false,mixed,Thin 4-star row that helps corpus breadth more than benchmark truth.,triaged,corpus_only,,,,
matiasrueda_20260328_isaac_4,20260328_phase1,Matias Jose Rueda,4,avvo,TX,family_law,mixed_4_star;explicit_positive_trust,benchmark_candidate,true,false,false,mixed,"Kept. Useful mixed four-star divorce row with explicit trust and responsiveness language, while staying out of praise-only inference.",reviewed_candidate_subset,reviewed_candidate,parent_agent,2026-03-28,"[{""theme"": ""professionalism_trust"", ""polarity"": ""positive"", ""severity"": ""positive"", ""evidence"": ""Knowledgable and dependable""}, {""theme"": ""communication_responsiveness"", ""polarity"": ""positive"", ""severity"": ""positive"", ""evidence"": ""kept me informed through different types of media""}]","Kept. Useful mixed four-star divorce row with explicit trust and responsiveness language, while staying out of praise-only inference."
robertafay_20260328_sarah_4,20260328_phase1,Roberta Sue Fay,4,avvo,OH,family_law,mixed_4_star;explicit_positive_trust,audit_only,false,false,true,mixed,Recommendation-style praise and endorsement framing make this a benchmark-design ambiguity rather than a clean rule-driving row.,triaged,audit_only,,,,
